{
    "$schema": "./theme-schema.json",
    "meta": {
        "id": "kawaii-dark",
        "name": "Kawaii Dark",
        "author": "Sameko Team",
        "version": "1.0.0",
        "description": "Ocean-inspired dark theme with soft blue tones",
        "type": "dark",
        "tags": [
            "dark",
            "ocean",
            "kawaii",
            "default"
        ]
    },
    "colors": {
        "bgOceanLight": "#2a3a4a",
        "bgOceanMedium": "#1e2d3d",
        "bgOceanDeep": "#88c9ea",
        "bgOceanDark": "#152535",
        "bgGlass": "rgba(26, 37, 48, 0.92)",
        "bgGlassHeavy": "rgba(37, 64, 90, 0.97)",
        "bgGlassBorder": "rgba(40, 60, 80, 0.9)",
        "accent": "#88c9ea",
        "accentHover": "#5eb7e0",
        "textPrimary": "#e0f0ff",
        "textSecondary": "#a0c0d0",
        "textMuted": "#7990a0",
        "success": "#7dcea0",
        "error": "#ff8fab",
        "warning": "#fcd5ce",
        "border": "#3a6075",
        "borderStrong": "#88c9ea",
        "shadowSoft": "0 8px 32px rgba(0, 0, 0, 0.4)",
        "shadowCard": "0 4px 12px rgba(0, 0, 0, 0.3)",
        "glow": "0 0 15px rgba(136, 201, 234, 0.4)",
        "bgHeader": "rgba(21, 37, 53, 0.97)",
        "bgPanel": "rgba(26, 37, 48, 0.95)",
        "bgInput": "#1a2a3a",
        "bgButton": "#2a4050",
        "bgButtonHover": "#3a5565",
        "editorBg": "#1a2530",
        "terminalBg": "#1e2933",
        "settingsLabelColor": "#e0f0ff",
        "settingsSectionColor": "#88c9ea"
    },
    "editor": {
        "base": "vs-dark",
        "inherit": true,
        "background": "#1a2530",
        "foreground": "#e0f0ff",
        "lineHighlight": "#243040",
        "selection": "#88c9ea40",
        "cursor": "#88c9ea",
        "lineNumber": "#4a6a7a",
        "lineNumberActive": "#88c9ea",
        "scrollbar": "#4a6a7a50",
        "scrollbarHover": "#6a8a9a70",
        "scrollbarActive": "#88c9ea80",
        "syntax": {
            "comment": {
                "color": "6a8a9a",
                "fontStyle": "italic"
            },
            "keyword": {
                "color": "88c9ea"
            },
            "string": {
                "color": "a3d9a5"
            },
            "number": {
                "color": "ebcb8b"
            },
            "type": {
                "color": "e8a8b8"
            },
            "function": {
                "color": "7ec8e3"
            },
            "variable": {
                "color": "9cdcfe"
            },
            "operator": {
                "color": "e0f0ff"
            },
            "bracket": {
                "color": "ffd700"
            }
        }
    },
    "terminal": {
        "background": "#1e2933",
        "foreground": "#e0f0ff",
        "cursor": "#88c9ea",
        "ansi": {
            "black": "#1a2530",
            "red": "#ff8fab",
            "green": "#7dcea0",
            "yellow": "#ebcb8b",
            "blue": "#88c9ea",
            "magenta": "#e8a8b8",
            "cyan": "#7ec8e3",
            "white": "#e0f0ff"
        }
    }
}