{
    "$schema": "./theme-schema.json",
    "meta": {
        "id": "sakura",
        "name": "Sakura",
        "author": "Sameko Team",
        "version": "1.0.0",
        "description": "Soft pastel pink UI with dark rose editor - inspired by cherry blossoms",
        "type": "light",
        "tags": [
            "light",
            "pink",
            "pastel",
            "cute"
        ]
    },
    "colors": {
        "bgOceanLight": "#fff5f8",
        "bgOceanMedium": "#ffe4e1",
        "bgOceanDeep": "#ffb7c5",
        "bgOceanDark": "#e097a8",
        "bgGlass": "rgba(255, 245, 250, 0.92)",
        "bgGlassHeavy": "rgba(255, 228, 225, 0.97)",
        "bgGlassBorder": "rgba(255, 182, 193, 0.6)",
        "accent": "#ff9aaf",
        "accentHover": "#ff758f",
        "textPrimary": "#5d4a4d",
        "textSecondary": "#8b5f65",
        "textMuted": "#bc8f8f",
        "success": "#b8e2b8",
        "error": "#ffb3b3",
        "warning": "#fff9c4",
        "border": "#ffcad4",
        "borderStrong": "#ffb7c5",
        "shadowSoft": "0 8px 32px rgba(255, 182, 193, 0.25)",
        "shadowCard": "0 4px 12px rgba(255, 105, 180, 0.15)",
        "glow": "0 0 15px rgba(255, 182, 193, 0.4)",
        "bgHeader": "rgba(255, 228, 225, 0.97)",
        "bgPanel": "rgba(255, 245, 248, 0.95)",
        "bgInput": "#fffafa",
        "bgButton": "#fff0f5",
        "bgButtonHover": "#ffe4e1",
        "editorBg": "#2d1f2f",
        "terminalBg": "#251a26",
        "settingsLabelColor": "#8b5f65",
        "settingsSectionColor": "#ff9aaf",
        "buttonTextOnAccent": "#ffffff"
    },
    "editor": {
        "base": "vs-dark",
        "inherit": true,
        "background": "#2d1f2f",
        "foreground": "#f8e8f0",
        "lineHighlight": "#3d2a3f",
        "selection": "#5d3a5f",
        "cursor": "#ff69b4",
        "lineNumber": "#6d5060",
        "lineNumberActive": "#ff69b4",
        "scrollbar": "#5d3a5f60",
        "scrollbarHover": "#7d4a6f",
        "scrollbarActive": "#ff69b4",
        "syntax": {
            "comment": {
                "color": "8b7080",
                "fontStyle": "italic"
            },
            "keyword": {
                "color": "ff69b4"
            },
            "string": {
                "color": "98d998"
            },
            "number": {
                "color": "da75e3"
            },
            "type": {
                "color": "ffb7c5",
                "fontStyle": "italic"
            },
            "function": {
                "color": "ffb07a"
            },
            "variable": {
                "color": "f8e8f0"
            },
            "operator": {
                "color": "ff69b4"
            }
        }
    },
    "terminal": {
        "background": "#251a26",
        "foreground": "#f8e8f0",
        "cursor": "#ff69b4",
        "ansi": {
            "black": "#251a26",
            "red": "#ff6961",
            "green": "#77dd77",
            "yellow": "#fdfd96",
            "blue": "#aec6cf",
            "magenta": "#ffb7c5",
            "cyan": "#97cbdc",
            "white": "#f8e8f0"
        }
    }
}